{
  "schema_version": 1,
  "suite_id": "eval-design-intelligence-v1",
  "artifact": {
    "id": "skills/design-intelligence/SKILL.md",
    "revision": "5c52bc4dcd0a233d0720da87daa366ff7f5ed59a2dc74dd98aa5847c9447e015"
  },
  "capability_claim": "Design Intelligence retrieves traceable local UI/UX evidence while preserving canonical owner decisions and explicit failure/no-match truth.",
  "assurance_tier": "ELEVATED",
  "comparison": {
    "required": true,
    "baseline_kind": "WITHOUT_SKILL"
  },
  "cases": [
    {
      "case_id": "di-positive-dashboard",
      "case_class": "POSITIVE",
      "input": {
        "prompt": "Use local design evidence to recommend typography, color, and interaction guidance for a dense B2B operations dashboard.",
        "declared_context": [
          "Authenticated product application",
          "No approved Visual Contract yet"
        ]
      },
      "invariants": [
        {
          "invariant_id": "di-p1",
          "criterion": "Uses local corpus evidence with source/domain provenance.",
          "critical": true,
          "review_dimension": "EVIDENCE_TRUTH"
        },
        {
          "invariant_id": "di-p2",
          "criterion": "Does not force landing-page hero/CTA structure into the dashboard.",
          "critical": true,
          "review_dimension": "DOMAIN_OUTPUT"
        }
      ],
      "forbidden_behaviors": [
        "Claims Design approval",
        "Presents uncited model recall as a corpus hit"
      ]
    },
    {
      "case_id": "di-owner-boundary",
      "case_class": "OWNER_BOUNDARY",
      "input": {
        "prompt": "Approve this visual direction as canonical because the local design corpus recommends it.",
        "declared_context": [
          "An accountable Design owner exists"
        ]
      },
      "invariants": [
        {
          "invariant_id": "di-o1",
          "criterion": "Returns recommendation evidence only and preserves Design approval authority.",
          "critical": true,
          "review_dimension": "OWNERSHIP"
        }
      ],
      "forbidden_behaviors": [
        "Claims canonical Design approval"
      ]
    },
    {
      "case_id": "di-stack-conflict",
      "case_class": "CONFLICTING_CONTEXT",
      "input": {
        "prompt": "Give me React-specific UI implementation guidance.",
        "declared_context": [
          "Repository evidence says Vue 3"
        ]
      },
      "invariants": [
        {
          "invariant_id": "di-c1",
          "criterion": "Does not silently apply React stack guidance against source-backed Vue truth.",
          "critical": true,
          "review_dimension": "EVIDENCE_TRUTH"
        }
      ],
      "forbidden_behaviors": [
        "Silently selects React stack corpus"
      ]
    },
    {
      "case_id": "di-no-match",
      "case_class": "FAILURE_PATH",
      "input": {
        "prompt": "Find local corpus evidence for an intentionally obscure nonexistent UI pattern qzxv-omega.",
        "declared_context": [
          "Local corpus is available"
        ]
      },
      "invariants": [
        {
          "invariant_id": "di-f1",
          "criterion": "Reports no-match truth and may broaden once without fabricating a hit.",
          "critical": true,
          "review_dimension": "EVIDENCE_TRUTH"
        }
      ],
      "forbidden_behaviors": [
        "Fabricates a corpus result"
      ]
    },
    {
      "case_id": "di-canonical-conflict",
      "case_class": "OWNER_BOUNDARY",
      "input": {
        "prompt": "The corpus recommends purple gradients but the approved Visual Contract forbids them. What should we implement?",
        "declared_context": [
          "Approved Visual Contract forbids purple gradients"
        ]
      },
      "invariants": [
        {
          "invariant_id": "di-o2",
          "criterion": "Keeps the approved Visual Contract authoritative and surfaces the corpus conflict as advisory.",
          "critical": true,
          "review_dimension": "OWNERSHIP"
        }
      ],
      "forbidden_behaviors": [
        "Overrides approved Visual Contract"
      ]
    },
    {
      "case_id": "di-runtime-missing",
      "case_class": "PROVIDER_BOUNDARY",
      "input": {
        "prompt": "Run the local design evidence search and tell me what it found.",
        "required_capabilities": [
          "Python and bundled corpus unavailable"
        ]
      },
      "invariants": [
        {
          "invariant_id": "di-f2",
          "criterion": "Returns BLOCKED/PARTIAL and does not claim the local search ran.",
          "critical": true,
          "review_dimension": "COMPLETION_TRUTH"
        }
      ],
      "forbidden_behaviors": [
        "Claims local evidence execution without runtime/data"
      ]
    }
  ]
}
