{
  "schema_version": 1,
  "suite_id": "codebase-design-foundation-economy-v1",
  "artifact": {
    "id": "skills/codebase-design/SKILL.md",
    "revision": "1d9630cca990c8f4cb9aaeec737fb6a56826e095a70a4d584d6b2ae820617010"
  },
  "capability_claim": "A fixed technical design first tests fit-for-purpose existing/runtime/platform/dependency mechanisms and explicitly classifies shared/foundation impact with minimum runway and walking-skeleton proof without selecting by line/file count.",
  "assurance_tier": "ELEVATED",
  "comparison": {
    "required": true,
    "baseline_kind": "PREVIOUS_REVISION",
    "baseline_revision": "d333b2bc355e7699e9121821127e7fcc9e0f1a8ed7651191d76bebd41ee69a24"
  },
  "cases": [
    {
      "case_id": "existing-platform-mechanism-holds",
      "case_class": "REGRESSION",
      "input": {
        "prompt": "Design a fixed technical decision where the supported platform already provides the exact required primitive and current canonical callers can use it."
      },
      "invariants": [
        {
          "invariant_id": "economy-first",
          "criterion": "Evaluate and select the sufficient existing/platform mechanism before inventing custom alternatives.",
          "critical": true,
          "review_dimension": "DECISION_QUALITY"
        }
      ],
      "forbidden_behaviors": [
        "Fabricate a custom option merely to satisfy a minimum alternatives count."
      ]
    },
    {
      "case_id": "shared-ui-decision-produces-runway",
      "case_class": "POSITIVE",
      "input": {
        "prompt": "Design an approved shared frontend token/component seam required by three current screens."
      },
      "invariants": [
        {
          "invariant_id": "foundation-impact",
          "criterion": "Classify SHARED/FOUNDATION from current consumers, define the minimum runway, blockers and one representative walking-skeleton proof.",
          "critical": true,
          "review_dimension": "DOMAIN_OUTPUT"
        }
      ],
      "forbidden_behaviors": [
        "Design a full future design system beyond current consumers."
      ]
    },
    {
      "case_id": "contained-change-no-foundation",
      "case_class": "NEAR_MISS",
      "input": {
        "prompt": "Design a local internal module change with one current caller and no shared contract impact."
      },
      "invariants": [
        {
          "invariant_id": "contained",
          "criterion": "Keep impact CONTAINED when source evidence does not justify shared/foundation work.",
          "critical": true,
          "review_dimension": "DECISION_QUALITY"
        }
      ]
    }
  ]
}
