{
  "schema_version": 1,
  "suite_id": "native-system-router-liveness-v1",
  "artifact": {
    "id": "skills/upgrade-sdlc-intelligence/SKILL.md",
    "revision": "c9b28be62cecd2f419868bfc35cf2f2a2600d5fe0e1f11adc81cb2034435aa52"
  },
  "capability_claim": "Broad reusable-system maintenance has one implicit-visible System routing entrypoint that selects exactly one canonical System owner and never takes over target-project Delivery work.",
  "assurance_tier": "ELEVATED",
  "comparison": {
    "required": true,
    "baseline_kind": "PREVIOUS_REVISION",
    "baseline_revision": "09aadfc75c143f6f72a51f59211209ae4259b3e36102c52ca3261c2301e88bcb"
  },
  "cases": [
    {
      "case_id": "broad-system-route",
      "case_class": "POSITIVE",
      "input": {
        "prompt": "Strengthen this reusable SDLC plugin after an audit found routing and evidence problems, then send the fixed artifact to the right next lifecycle owner."
      },
      "invariants": [
        {
          "invariant_id": "broad-system-route-invariant",
          "criterion": "Select the Upgrade SDLC Intelligence System router; resolve one canonical System owner only when artifact state supports it, otherwise preserve a truthful PARTIAL/BLOCKED route decision.",
          "critical": true,
          "review_dimension": "OWNERSHIP"
        }
      ]
    },
    {
      "case_id": "existing-artifact-audit-precedence",
      "case_class": "REGRESSION",
      "input": {
        "prompt": "This reusable Skill already exists, but I am not sure whether its ownership and invocation are correct. Improve it."
      },
      "invariants": [
        {
          "invariant_id": "existing-artifact-audit-precedence-invariant",
          "criterion": "Route first to audit-sdlc-artifact because artifact fitness is unresolved; do not jump directly to construction.",
          "critical": true,
          "review_dimension": "OWNERSHIP"
        }
      ]
    },
    {
      "case_id": "delivery-boundary",
      "case_class": "OWNER_BOUNDARY",
      "input": {
        "prompt": "Implement the approved login story in this product repository and verify it."
      },
      "invariants": [
        {
          "invariant_id": "delivery-boundary-invariant",
          "criterion": "Do not use the System router for target-project delivery work.",
          "critical": true,
          "review_dimension": "OWNERSHIP"
        }
      ]
    },
    {
      "case_id": "clear-system-owner",
      "case_class": "NEAR_MISS",
      "input": {
        "prompt": "Run the frozen behavioral evaluation suite for this fixed reusable Skill revision."
      },
      "invariants": [
        {
          "invariant_id": "clear-system-owner-invariant",
          "criterion": "Use the System router as the visible entrypoint, route to qualify-sdlc-capability as the exact owner, and do not imitate or perform qualification from router reasoning.",
          "critical": true,
          "review_dimension": "OWNERSHIP"
        }
      ]
    }
  ]
}
