{
  "schema_version": 1,
  "suite_id": "foundation-aware-delivery-v1",
  "artifact": {
    "id": "skills/to-tickets/SKILL.md",
    "revision": "f8777f3c1dccf755c54f4c3208dea4d45d3a269366c0f805bab79993f85e1223"
  },
  "capability_claim": "Planning makes source-grounded shared/foundation prerequisites and a representative walking skeleton first-class blockers instead of forcing every approved obligation directly into feature vertical slices.",
  "assurance_tier": "ELEVATED",
  "comparison": {
    "required": true,
    "baseline_kind": "PREVIOUS_REVISION",
    "baseline_revision": "7b505af702293fc048c4306b13ce883808faccda7e5cdd6c0ad2d510c6ce7f34"
  },
  "cases": [
    {
      "case_id": "shared-ui-foundation-before-pages",
      "case_class": "REGRESSION",
      "input": {
        "prompt": "Plan implementation for three approved screens. The approved Visual Contract identifies shared FOUNDATION impact: new token roles, reusable form-field states, and responsive shell behavior are absent from the codebase."
      },
      "invariants": [
        {
          "invariant_id": "foundation-node",
          "criterion": "Create a bounded FOUNDATION prerequisite for the approved shared UI capability before dependent page slices.",
          "critical": true,
          "review_dimension": "DOMAIN_OUTPUT"
        },
        {
          "invariant_id": "walking-skeleton",
          "criterion": "Create one representative WALKING_SKELETON that exercises the new foundation through a real screen before the remaining page slices.",
          "critical": true,
          "review_dimension": "DECISION_QUALITY"
        }
      ],
      "forbidden_behaviors": [
        "Create three page vertical slices first and defer shared components until duplication appears."
      ]
    },
    {
      "case_id": "no-speculative-foundation",
      "case_class": "NEAR_MISS",
      "input": {
        "prompt": "Plan one approved isolated admin screen. Current code has a sufficient canonical layout/component path and no approved future consumers or shared impact."
      },
      "invariants": [
        {
          "invariant_id": "contained-slice",
          "criterion": "Keep the work CONTAINED/vertical; do not invent a design-system foundation project for hypothetical reuse.",
          "critical": true,
          "review_dimension": "DECISION_QUALITY"
        }
      ]
    },
    {
      "case_id": "data-contract-prerequisite",
      "case_class": "REGRESSION",
      "input": {
        "prompt": "Plan an API feature whose approved behavior depends on a new canonical status model and invariant shared by API writes, background jobs, and reporting. The technical data decision is approved but not implemented."
      },
      "invariants": [
        {
          "invariant_id": "data-foundation",
          "criterion": "Represent the approved canonical data/invariant implementation as a blocking FOUNDATION/MIGRATION node before dependent API/feature slices.",
          "critical": true,
          "review_dimension": "DOMAIN_OUTPUT"
        }
      ]
    },
    {
      "case_id": "prototype-not-production-foundation",
      "case_class": "OWNER_BOUNDARY",
      "input": {
        "prompt": "A throwaway prototype proved an interaction. Plan production delivery; the prototype includes local CSS/components that were never reviewed as the production UI system."
      },
      "invariants": [
        {
          "invariant_id": "prototype-boundary",
          "criterion": "Carry prototype learning as input only; require production design/foundation/implementation nodes rather than treating prototype bytes as completed foundation.",
          "critical": true,
          "review_dimension": "OWNERSHIP"
        }
      ]
    }
  ]
}
