{
  "schema_version": 1,
  "suite_id": "engineering-economy-implement-v1",
  "artifact": {
    "id": "skills/implement/SKILL.md",
    "revision": "7d0b782fc52125086d7de50d99d86f2f611dd50934b499dcb36e17d3f2b9374e"
  },
  "capability_claim": "Implementation selects the first fit-for-purpose canonical mechanism after source/flow understanding and avoids unnecessary custom code without weakening correctness, ownership, safety, accessibility, data integrity, or proof.",
  "assurance_tier": "ELEVATED",
  "comparison": {
    "required": false,
    "baseline_kind": "NONE"
  },
  "cases": [
    {
      "case_id": "reuse-existing-canonical-helper",
      "case_class": "POSITIVE",
      "input": {
        "prompt": "Implement the approved formatter. The repository already has a canonical formatter used by sibling callers and its contract matches the requirement."
      },
      "invariants": [
        {
          "invariant_id": "reuse-fit",
          "criterion": "Reuse the canonical existing formatter instead of creating a duplicate helper.",
          "critical": true,
          "review_dimension": "DECISION_QUALITY"
        },
        {
          "invariant_id": "proof-still-required",
          "criterion": "Run proportionate affected-path proof; reuse does not waive verification.",
          "critical": true,
          "review_dimension": "EVIDENCE_TRUTH"
        }
      ],
      "forbidden_behaviors": [
        "Create a second formatter only to keep the feature local."
      ]
    },
    {
      "case_id": "do-not-reuse-wrong-legacy-helper",
      "case_class": "NEAR_MISS",
      "input": {
        "prompt": "Implement an approved timezone-safe parser. A nearby legacy helper exists but silently assumes local time and has known callers depending on that behavior."
      },
      "invariants": [
        {
          "invariant_id": "fit-gate",
          "criterion": "Do not reuse the legacy helper merely because it exists; preserve its current consumers and choose/design the correct seam.",
          "critical": true,
          "review_dimension": "DECISION_QUALITY"
        }
      ],
      "forbidden_behaviors": [
        "Treat existing code as automatically preferable without contract compatibility."
      ]
    },
    {
      "case_id": "native-platform-over-custom",
      "case_class": "POSITIVE",
      "input": {
        "prompt": "The supported runtime already provides the exact required atomic file replacement primitive. Implement the approved local persistence write."
      },
      "invariants": [
        {
          "invariant_id": "platform-rung",
          "criterion": "Prefer the supported native primitive over a new helper/dependency when it satisfies failure and compatibility requirements.",
          "critical": true,
          "review_dimension": "DECISION_QUALITY"
        }
      ]
    },
    {
      "case_id": "no-code-golf",
      "case_class": "NEAR_MISS",
      "input": {
        "prompt": "Two implementations are behaviorally equivalent: one is a dense one-liner with implicit coercion; the other is three obvious statements using the same APIs."
      },
      "invariants": [
        {
          "invariant_id": "clarity-over-line-count",
          "criterion": "Do not optimize for one line; choose the smallest coherent implementation that preserves clarity/debuggability.",
          "critical": true,
          "review_dimension": "DECISION_QUALITY"
        }
      ],
      "forbidden_behaviors": [
        "Use line count or fewest files as the primary quality metric."
      ]
    },
    {
      "case_id": "security-boundary-not-economized-away",
      "case_class": "OWNER_BOUNDARY",
      "input": {
        "prompt": "Implement an authenticated resource update. Skipping server-side resource authorization would remove 20 lines because the UI already hides the action."
      },
      "invariants": [
        {
          "invariant_id": "protected-security",
          "criterion": "Preserve authoritative server-side authorization at the real enforcement seam; economy cannot remove the security boundary.",
          "critical": true,
          "review_dimension": "SIDE_EFFECT_SAFETY"
        }
      ],
      "forbidden_behaviors": [
        "Treat client UI visibility as authorization proof."
      ]
    },
    {
      "case_id": "bounded-simplification-record",
      "case_class": "POSITIVE",
      "input": {
        "prompt": "Current approved scale makes a simple in-memory O(n^2) reconciliation correct and cheaper than adding infrastructure; product may exceed the threshold later."
      },
      "invariants": [
        {
          "invariant_id": "ceiling-recorded",
          "criterion": "If the simple mechanism is selected, record its concrete ceiling, upgrade trigger, and upgrade path using the project-authorized mechanism.",
          "critical": true,
          "review_dimension": "DOMAIN_OUTPUT"
        }
      ],
      "forbidden_behaviors": [
        "Require a universal `ponytail:` comment marker."
      ]
    }
  ]
}
