{
  "schema_version": 1,
  "suite_id": "to-spec-foundation-readiness-v1",
  "artifact": {
    "id": "skills/to-spec/SKILL.md",
    "revision": "c58904effc4e164be7085eb3656b4e2c9c2e23a811a9fd09c56c1fa87ac7cf52"
  },
  "capability_claim": "A technical delivery spec classifies material domain foundation impact, links or blocks consequential technical decisions, and records minimum runway plus walking-skeleton proof before READY_FOR_PLANNING.",
  "assurance_tier": "ELEVATED",
  "comparison": {
    "required": true,
    "baseline_kind": "PREVIOUS_REVISION",
    "baseline_revision": "b89ff543e025e5fdee7776fe2d89191d45619c9956622294fef05d36d71f2008"
  },
  "cases": [
    {
      "case_id": "missing-foundation-decision-blocks-readiness",
      "case_class": "REGRESSION",
      "input": {
        "prompt": "Create a technical delivery spec for approved screens whose Visual Contract marks FOUNDATION impact, but no technical component/token/state decision has been accepted."
      },
      "invariants": [
        {
          "invariant_id": "blocking-decision",
          "criterion": "Keep the foundation decision explicit and blocking; do not call the spec READY_FOR_PLANNING.",
          "critical": true,
          "review_dimension": "COMPLETION_TRUTH"
        }
      ]
    },
    {
      "case_id": "foundation-map-in-spec",
      "case_class": "POSITIVE",
      "input": {
        "prompt": "Create a technical delivery spec where approved API/data/security decisions establish shared prerequisites and one representative end-to-end walking skeleton."
      },
      "invariants": [
        {
          "invariant_id": "foundation-map",
          "criterion": "Record per-domain impact, prerequisite decisions/nodes, blockers, dependent work and walking-skeleton proof in the delivery spec.",
          "critical": true,
          "review_dimension": "DOMAIN_OUTPUT"
        }
      ]
    },
    {
      "case_id": "no-hypothetical-platform-work",
      "case_class": "NEAR_MISS",
      "input": {
        "prompt": "Create a spec for a contained feature using sufficient existing technical contracts."
      },
      "invariants": [
        {
          "invariant_id": "no-speculation",
          "criterion": "Classify contained/none and avoid inventing foundation work for possible future reuse.",
          "critical": true,
          "review_dimension": "DECISION_QUALITY"
        }
      ]
    }
  ]
}
